{
  "$schema": "./level-game.schema.json",
  "id": "level_13_easy",
  "tier": "tier_3",
  "title": "Full Adder",
  "objective": "Add 3 bits (A, B, Cin)",
  "description": "The building block of multi-bit addition.",
  "introText": "FULL ADDER & CARRY PROPAGATION: A Full Adder accepts three inputs (A, B, Carry_in) and produces Sum and Carry_out.",
  "physicsVisual": "full_adder_detailed",
  "hint": "Use two Half Adders logic.",
  "availableGates": [
    "transistor",
    "not",
    "and",
    "or",
    "nand",
    "nor",
    "xor",
    "mux2to1"
  ],
  "inputs": 3,
  "targetTruthTable": [
    {
      "in": [
        0,
        0,
        0
      ],
      "out": [
        0,
        0
      ]
    },
    {
      "in": [
        0,
        0,
        1
      ],
      "out": [
        1,
        0
      ]
    },
    {
      "in": [
        0,
        1,
        0
      ],
      "out": [
        1,
        0
      ]
    },
    {
      "in": [
        0,
        1,
        1
      ],
      "out": [
        0,
        1
      ]
    },
    {
      "in": [
        1,
        0,
        0
      ],
      "out": [
        1,
        0
      ]
    },
    {
      "in": [
        1,
        0,
        1
      ],
      "out": [
        0,
        1
      ]
    },
    {
      "in": [
        1,
        1,
        0
      ],
      "out": [
        0,
        1
      ]
    },
    {
      "in": [
        1,
        1,
        1
      ],
      "out": [
        1,
        1
      ]
    }
  ],
  "maxGates": 5,
  "xpReward": 100,
  "storyText": "ADDER ARCHITECTURES: (1) RIPPLE-CARRY: Simple, O(n) delay. (2) CARRY-LOOKAHEAD (CLA): Parallel carries, O(log n) delay. (3) CARRY-SELECT: Speculate both carry values, MUX the result. Modern CPUs use hybrid architectures balancing speed and area.",
  "physicsDetails": {
    "conceptCards": [
      {
        "term": "Full Adder",
        "definition": "A circuit that adds three single-bit inputs (A, B, Carry-in) and produces Sum and Carry-out.",
        "why": "Full adders can be chained to create n-bit adders—the carry-out of one stage becomes carry-in of the next.",
        "analogy": "Like adding a column in multi-digit addition: you add the two digits PLUS any carry from the previous column.",
        "visuals": [
          {
            "type": "full_adder_detailed",
            "title": "Full Adder: Carry Propagate"
          }
        ],
        "latex": "Sum = A \\oplus B \\oplus Cin, Cout = (A\\cdot B) + (Cin\\cdot (A\\oplus B))",
        "html": "<span class=\"katex\"><span class=\"katex-html\" aria-hidden=\"true\"><span class=\"base\"><span class=\"strut\" style=\"height:0.6833em;\"></span><span class=\"mord mathnormal\" style=\"margin-right:0.05764em;\">S</span><span class=\"mord mathnormal\">u</span><span class=\"mord mathnormal\">m</span><span class=\"mspace\" style=\"margin-right:0.2778em;\"></span><span class=\"mrel\">=</span><span class=\"mspace\" style=\"margin-right:0.2778em;\"></span></span><span class=\"base\"><span class=\"strut\" style=\"height:0.7667em;vertical-align:-0.0833em;\"></span><span class=\"mord mathnormal\">A</span><span class=\"mspace\" style=\"margin-right:0.2222em;\"></span><span class=\"mbin\">⊕</span><span class=\"mspace\" style=\"margin-right:0.2222em;\"></span></span><span class=\"base\"><span class=\"strut\" style=\"height:0.7667em;vertical-align:-0.0833em;\"></span><span class=\"mord mathnormal\" style=\"margin-right:0.05017em;\">B</span><span class=\"mspace\" style=\"margin-right:0.2222em;\"></span><span class=\"mbin\">⊕</span><span class=\"mspace\" style=\"margin-right:0.2222em;\"></span></span><span class=\"base\"><span class=\"strut\" style=\"height:0.8778em;vertical-align:-0.1944em;\"></span><span class=\"mord mathnormal\" style=\"margin-right:0.07153em;\">C</span><span class=\"mord mathnormal\">in</span><span class=\"mpunct\">,</span><span class=\"mspace\" style=\"margin-right:0.1667em;\"></span><span class=\"mord mathnormal\" style=\"margin-right:0.07153em;\">C</span><span class=\"mord mathnormal\">o</span><span class=\"mord mathnormal\">u</span><span class=\"mord mathnormal\">t</span><span class=\"mspace\" style=\"margin-right:0.2778em;\"></span><span class=\"mrel\">=</span><span class=\"mspace\" style=\"margin-right:0.2778em;\"></span></span><span class=\"base\"><span class=\"strut\" style=\"height:1em;vertical-align:-0.25em;\"></span><span class=\"mopen\">(</span><span class=\"mord mathnormal\">A</span><span class=\"mspace\" style=\"margin-right:0.2222em;\"></span><span class=\"mbin\">⋅</span><span class=\"mspace\" style=\"margin-right:0.2222em;\"></span><span class=\"mord mathnormal\" style=\"margin-right:0.05017em;\">B</span><span class=\"mclose\">)</span><span class=\"mspace\" style=\"margin-right:0.2222em;\"></span><span class=\"mbin\">+</span><span class=\"mspace\" style=\"margin-right:0.2222em;\"></span></span><span class=\"base\"><span class=\"strut\" style=\"height:1em;vertical-align:-0.25em;\"></span><span class=\"mopen\">(</span><span class=\"mord mathnormal\" style=\"margin-right:0.07153em;\">C</span><span class=\"mord mathnormal\">in</span><span class=\"mspace\" style=\"margin-right:0.2222em;\"></span><span class=\"mbin\">⋅</span><span class=\"mspace\" style=\"margin-right:0.2222em;\"></span></span><span class=\"base\"><span class=\"strut\" style=\"height:1em;vertical-align:-0.25em;\"></span><span class=\"mopen\">(</span><span class=\"mord mathnormal\">A</span><span class=\"mspace\" style=\"margin-right:0.2222em;\"></span><span class=\"mbin\">⊕</span><span class=\"mspace\" style=\"margin-right:0.2222em;\"></span><span class=\"mord mathnormal\" style=\"margin-right:0.05017em;\">B</span><span class=\"mclose\">))</span></span></span></span>"
      },
      {
        "term": "Carry-In (Cin)",
        "definition": "The carry bit from the previous (lower) bit position. This is what distinguishes a full adder from a half adder.",
        "why": "In multi-bit addition, each bit position must account for overflow from the previous position.",
        "analogy": "The '1' you wrote above the next column when doing longhand addition.",
        "latex": "Cin comes from previous stage's Cout",
        "html": "<span class=\"katex\"><span class=\"katex-html\" aria-hidden=\"true\"><span class=\"base\"><span class=\"strut\" style=\"height:0.9463em;vertical-align:-0.1944em;\"></span><span class=\"mord mathnormal\" style=\"margin-right:0.07153em;\">C</span><span class=\"mord mathnormal\">in</span><span class=\"mord mathnormal\">co</span><span class=\"mord mathnormal\">m</span><span class=\"mord mathnormal\">es</span><span class=\"mord mathnormal\" style=\"margin-right:0.10764em;\">f</span><span class=\"mord mathnormal\">ro</span><span class=\"mord mathnormal\">m</span><span class=\"mord mathnormal\">p</span><span class=\"mord mathnormal\">re</span><span class=\"mord mathnormal\" style=\"margin-right:0.03588em;\">v</span><span class=\"mord mathnormal\">i</span><span class=\"mord mathnormal\">o</span><span class=\"mord mathnormal\">u</span><span class=\"mord mathnormal\">ss</span><span class=\"mord mathnormal\">t</span><span class=\"mord mathnormal\">a</span><span class=\"mord mathnormal\" style=\"margin-right:0.03588em;\">g</span><span class=\"mord\"><span class=\"mord mathnormal\">e</span><span class=\"msupsub\"><span class=\"vlist-t\"><span class=\"vlist-r\"><span class=\"vlist\" style=\"height:0.7519em;\"><span style=\"top:-3.063em;margin-right:0.05em;\"><span class=\"pstrut\" style=\"height:2.7em;\"></span><span class=\"sizing reset-size6 size3 mtight\"><span class=\"mord mtight\"><span class=\"mord mtight\">′</span></span></span></span></span></span></span></span></span><span class=\"mord mathnormal\">s</span><span class=\"mord mathnormal\" style=\"margin-right:0.07153em;\">C</span><span class=\"mord mathnormal\">o</span><span class=\"mord mathnormal\">u</span><span class=\"mord mathnormal\">t</span></span></span></span>",
        "visuals": [
          {
            "type": "half_adder",
            "title": "Carry Chain"
          }
        ]
      },
      {
        "term": "Generate (G)",
        "definition": "A condition where a carry is produced regardless of the incoming carry. Occurs when both A and B are 1.",
        "why": "Generate signals enable carry-lookahead: we can compute carries without waiting for ripple.",
        "analogy": "Like two tall people standing together—they'll reach the ceiling regardless of what's below them.",
        "visuals": [
          {
            "type": "parallel_circuit",
            "title": "Generate: Both Inputs High"
          }
        ],
        "latex": "G = A \\cdot B",
        "html": "<span class=\"katex\"><span class=\"katex-html\" aria-hidden=\"true\"><span class=\"base\"><span class=\"strut\" style=\"height:0.6833em;\"></span><span class=\"mord mathnormal\">G</span><span class=\"mspace\" style=\"margin-right:0.2778em;\"></span><span class=\"mrel\">=</span><span class=\"mspace\" style=\"margin-right:0.2778em;\"></span></span><span class=\"base\"><span class=\"strut\" style=\"height:0.6833em;\"></span><span class=\"mord mathnormal\">A</span><span class=\"mspace\" style=\"margin-right:0.2222em;\"></span><span class=\"mbin\">⋅</span><span class=\"mspace\" style=\"margin-right:0.2222em;\"></span></span><span class=\"base\"><span class=\"strut\" style=\"height:0.6833em;\"></span><span class=\"mord mathnormal\" style=\"margin-right:0.05017em;\">B</span></span></span></span>"
      },
      {
        "term": "Propagate (P)",
        "definition": "A condition where an incoming carry passes through to the output. Occurs when exactly one of A or B is 1.",
        "why": "Propagate signals determine whether a carry chain continues or stops at each stage.",
        "analogy": "Like a relay runner—if you receive the baton (carry), you pass it on.",
        "visuals": [
          {
            "type": "series_circuit",
            "title": "Propagate: Carry Flow"
          }
        ],